{
  "_id": "595f280b557291a9750ebf66",
  "id": "595f280b557291a9750ebf66",
  "tags": [
    "cute",
    "orange"
  ],
  "mimetype": "image/jpeg",
  "size": 18234,
  "created_at": "2026-05-29T14:30:00Z",
  "edited_at": "2026-05-29T15:00:00Z",
  "validated": true,
  "url": "https://cataas.com/cat/595f280b557291a9750ebf66"
}